{
  "schema_version": "1.0.0",
  "name": "right_beaker_to_work",
  "description": "Approach, linearly grasp, close, and carry the right beaker to its work pose. Assumes open jaws: run prepare_open_grippers first.",
  "nodes": [
    {
      "id": "right_beaker_approach",
      "skill": "arm.move_joint",
      "version": "1.0.0",
      "arm": "right",
      "parameters": {
        "target_ref": "right.beaker.approach",
        "grip_requirement": "open"
      },
      "depends_on": []
    },
    {
      "id": "right_beaker_grasp",
      "skill": "arm.move_linear",
      "version": "1.0.0",
      "arm": "right",
      "parameters": {
        "source_ref": "right.beaker.approach",
        "target_ref": "right.beaker.grasp",
        "grip_requirement": "open"
      },
      "depends_on": [
        "right_beaker_approach"
      ]
    },
    {
      "id": "right_beaker_close",
      "skill": "gripper.set_position",
      "version": "1.0.0",
      "arm": "right",
      "parameters": {
        "position": 0,
        "allow_release": false,
        "at_ref": "right.beaker.grasp"
      },
      "depends_on": [
        "right_beaker_grasp"
      ]
    },
    {
      "id": "right_beaker_work",
      "skill": "arm.move_joint",
      "version": "1.0.0",
      "arm": "right",
      "parameters": {
        "source_ref": "right.beaker.grasp",
        "target_ref": "right.beaker.work",
        "grip_requirement": "clamped"
      },
      "depends_on": [
        "right_beaker_close"
      ]
    }
  ]
}
