{
  "schema_version": "1.0.0",
  "name": "right_beaker_pour_into_left_tube",
  "description": "Right arm picks the beaker, left arm picks the tube (independent sub-graphs, run concurrently). Carry-out is staggered like the return: the right beaker departs for its work pose first and the left tube departs no earlier than 8 s after the right arm set off. Then the right beaker tips into the tube mouth and returns upright. On the way back the left arm departs first and the right arm departs 5 s later, so the two returns overlap. Finally both arms return to the calibrated initial pose together. Assumes both jaws are already open: run prepare_open_grippers first, because this graph never opens a gripper.",
  "initial_facts": {
    "beaker_at": "right.beaker.approach_zone",
    "tube_at": "left.tube.approach_zone",
    "beaker_contents": "water",
    "tube_contents": "empty",
    "left_gripper": "open (must be prepared first)",
    "right_gripper": "open (must be prepared first)"
  },
  "nodes": [
    {
      "id": "left_tube_approach",
      "skill": "arm.move_joint",
      "version": "1.0.0",
      "arm": "left",
      "parameters": {
        "target_ref": "left.tube.approach",
        "grip_requirement": "open"
      },
      "depends_on": []
    },
    {
      "id": "right_beaker_approach",
      "skill": "arm.move_joint",
      "version": "1.0.0",
      "arm": "right",
      "parameters": {
        "target_ref": "right.beaker.approach",
        "grip_requirement": "open"
      },
      "depends_on": []
    },
    {
      "id": "left_tube_insert",
      "skill": "arm.move_linear",
      "version": "1.0.0",
      "arm": "left",
      "parameters": {
        "source_ref": "left.tube.approach",
        "target_ref": "left.tube.grasp",
        "grip_requirement": "open"
      },
      "depends_on": [
        "left_tube_approach"
      ]
    },
    {
      "id": "right_beaker_insert",
      "skill": "arm.move_linear",
      "version": "1.0.0",
      "arm": "right",
      "parameters": {
        "source_ref": "right.beaker.approach",
        "target_ref": "right.beaker.grasp",
        "grip_requirement": "open"
      },
      "depends_on": [
        "right_beaker_approach"
      ]
    },
    {
      "id": "left_tube_close",
      "skill": "gripper.set_position",
      "version": "1.0.0",
      "arm": "left",
      "parameters": {
        "position": 0,
        "allow_release": false,
        "at_ref": "left.tube.grasp"
      },
      "depends_on": [
        "left_tube_insert"
      ]
    },
    {
      "id": "right_beaker_close",
      "skill": "gripper.set_position",
      "version": "1.0.0",
      "arm": "right",
      "parameters": {
        "position": 0,
        "allow_release": false,
        "at_ref": "right.beaker.grasp"
      },
      "depends_on": [
        "right_beaker_insert"
      ]
    },
    {
      "id": "right_beaker_to_work",
      "skill": "arm.move_joint",
      "version": "1.0.0",
      "arm": "right",
      "parameters": {
        "source_ref": "right.beaker.grasp",
        "target_ref": "right.beaker.work",
        "grip_requirement": "clamped"
      },
      "depends_on": [
        "right_beaker_close"
      ]
    },
    {
      "id": "work_stagger_8s",
      "skill": "control.hold",
      "version": "1.0.0",
      "arm": "left",
      "parameters": {
        "seconds": 8
      },
      "depends_on": [
        "left_tube_close",
        "right_beaker_close"
      ]
    },
    {
      "id": "left_tube_to_work",
      "skill": "arm.move_joint",
      "version": "1.0.0",
      "arm": "left",
      "parameters": {
        "source_ref": "left.tube.grasp",
        "target_ref": "left.tube.work",
        "grip_requirement": "clamped"
      },
      "depends_on": [
        "left_tube_close",
        "work_stagger_8s"
      ]
    },
    {
      "id": "pour_into_tube",
      "skill": "arm.rotate_about_pivot",
      "version": "1.0.0",
      "arm": "right",
      "parameters": {
        "source_ref": "right.beaker.work",
        "tilt_deg": 80
      },
      "depends_on": [
        "left_tube_to_work",
        "right_beaker_to_work"
      ]
    },
    {
      "id": "right_beaker_untip",
      "skill": "arm.move_joint",
      "version": "1.0.0",
      "arm": "right",
      "parameters": {
        "target_ref": "right.beaker.work",
        "grip_requirement": "clamped"
      },
      "depends_on": [
        "pour_into_tube"
      ]
    },
    {
      "id": "return_stagger_5s",
      "skill": "control.hold",
      "version": "1.0.0",
      "arm": "right",
      "parameters": {
        "seconds": 5
      },
      "depends_on": [
        "right_beaker_untip"
      ]
    },
    {
      "id": "left_tube_return",
      "skill": "arm.move_joint",
      "version": "1.0.0",
      "arm": "left",
      "parameters": {
        "source_ref": "left.tube.work",
        "target_ref": "left.tube.grasp",
        "grip_requirement": "clamped"
      },
      "depends_on": [
        "right_beaker_untip"
      ]
    },
    {
      "id": "left_tube_release",
      "skill": "gripper.set_position",
      "version": "1.0.0",
      "arm": "left",
      "parameters": {
        "position": 255,
        "allow_release": true,
        "at_ref": "left.tube.grasp"
      },
      "depends_on": [
        "left_tube_return"
      ]
    },
    {
      "id": "left_tube_retreat",
      "skill": "arm.move_linear",
      "version": "1.0.0",
      "arm": "left",
      "parameters": {
        "source_ref": "left.tube.grasp",
        "target_ref": "left.tube.approach",
        "grip_requirement": "open"
      },
      "depends_on": [
        "left_tube_release"
      ]
    },
    {
      "id": "right_beaker_return",
      "skill": "arm.move_joint",
      "version": "1.0.0",
      "arm": "right",
      "parameters": {
        "source_ref": "right.beaker.work",
        "target_ref": "right.beaker.grasp",
        "grip_requirement": "clamped"
      },
      "depends_on": [
        "right_beaker_untip",
        "return_stagger_5s"
      ]
    },
    {
      "id": "right_beaker_release",
      "skill": "gripper.set_position",
      "version": "1.0.0",
      "arm": "right",
      "parameters": {
        "position": 255,
        "allow_release": true,
        "at_ref": "right.beaker.grasp"
      },
      "depends_on": [
        "right_beaker_return"
      ]
    },
    {
      "id": "right_beaker_retreat",
      "skill": "arm.move_linear",
      "version": "1.0.0",
      "arm": "right",
      "parameters": {
        "source_ref": "right.beaker.grasp",
        "target_ref": "right.beaker.approach",
        "grip_requirement": "open"
      },
      "depends_on": [
        "right_beaker_release"
      ]
    },
    {
      "id": "left_arm_home",
      "skill": "arm.move_to_home",
      "version": "1.0.0",
      "arm": "left",
      "parameters": {},
      "depends_on": [
        "left_tube_retreat",
        "right_beaker_retreat"
      ]
    },
    {
      "id": "right_arm_home",
      "skill": "arm.move_to_home",
      "version": "1.0.0",
      "arm": "right",
      "parameters": {},
      "depends_on": [
        "left_tube_retreat",
        "right_beaker_retreat"
      ]
    }
  ]
}
