{
  "schema_version": "1.0.0",
  "name": "prepare_open_grippers",
  "description": "Open both grippers with explicit release authorisation. Run this first, once the site confirms the jaws hold nothing; every task graph assumes open jaws and never opens them itself.",
  "initial_facts": {
    "left_gripper": "unknown; operator asserts empty",
    "right_gripper": "unknown; operator asserts empty"
  },
  "nodes": [
    {
      "id": "left_tube_gripper_open",
      "skill": "gripper.set_position",
      "version": "1.0.0",
      "arm": "left",
      "parameters": {
        "position": 255,
        "speed": 10,
        "allow_release": true
      },
      "depends_on": []
    },
    {
      "id": "right_beaker_gripper_open",
      "skill": "gripper.set_position",
      "version": "1.0.0",
      "arm": "right",
      "parameters": {
        "position": 255,
        "speed": 10,
        "allow_release": true
      },
      "depends_on": []
    }
  ]
}
