{
  "schema_version": "1.0.0",
  "name": "left_tube_to_work",
  "description": "Approach, linearly grasp, close, and carry the left tube to its work pose. Assumes open jaws: run prepare_open_grippers first.",
  "nodes": [
    {
      "id": "left_tube_approach",
      "skill": "arm.move_joint",
      "version": "1.0.0",
      "arm": "left",
      "parameters": {
        "target_ref": "left.tube.approach",
        "grip_requirement": "open"
      },
      "depends_on": []
    },
    {
      "id": "left_tube_grasp",
      "skill": "arm.move_linear",
      "version": "1.0.0",
      "arm": "left",
      "parameters": {
        "source_ref": "left.tube.approach",
        "target_ref": "left.tube.grasp",
        "grip_requirement": "open"
      },
      "depends_on": [
        "left_tube_approach"
      ]
    },
    {
      "id": "left_tube_close",
      "skill": "gripper.set_position",
      "version": "1.0.0",
      "arm": "left",
      "parameters": {
        "position": 0,
        "allow_release": false,
        "at_ref": "left.tube.grasp"
      },
      "depends_on": [
        "left_tube_grasp"
      ]
    },
    {
      "id": "left_tube_work",
      "skill": "arm.move_joint",
      "version": "1.0.0",
      "arm": "left",
      "parameters": {
        "source_ref": "left.tube.grasp",
        "target_ref": "left.tube.work",
        "grip_requirement": "clamped"
      },
      "depends_on": [
        "left_tube_close"
      ]
    }
  ]
}
