{
  "schema_version": "1.0.0",
  "name": "dual_prepare",
  "description": "Prepare both instruments serially; no parallel collision-free motion is asserted. Assumes open jaws: run prepare_open_grippers first.",
  "nodes": [
    {
      "id": "left_tube_approach",
      "skill": "arm.move_joint",
      "version": "1.0.0",
      "arm": "left",
      "parameters": {
        "target_ref": "left.tube.approach",
        "grip_requirement": "open"
      },
      "depends_on": []
    },
    {
      "id": "left_tube_grasp",
      "skill": "arm.move_linear",
      "version": "1.0.0",
      "arm": "left",
      "parameters": {
        "source_ref": "left.tube.approach",
        "target_ref": "left.tube.grasp",
        "grip_requirement": "open"
      },
      "depends_on": [
        "left_tube_approach"
      ]
    },
    {
      "id": "left_tube_close",
      "skill": "gripper.set_position",
      "version": "1.0.0",
      "arm": "left",
      "parameters": {
        "position": 0,
        "allow_release": false,
        "at_ref": "left.tube.grasp"
      },
      "depends_on": [
        "left_tube_grasp"
      ]
    },
    {
      "id": "left_tube_work",
      "skill": "arm.move_joint",
      "version": "1.0.0",
      "arm": "left",
      "parameters": {
        "source_ref": "left.tube.grasp",
        "target_ref": "left.tube.work",
        "grip_requirement": "clamped"
      },
      "depends_on": [
        "left_tube_close"
      ]
    },
    {
      "id": "right_beaker_approach",
      "skill": "arm.move_joint",
      "version": "1.0.0",
      "arm": "right",
      "parameters": {
        "target_ref": "right.beaker.approach",
        "grip_requirement": "open"
      },
      "depends_on": []
    },
    {
      "id": "right_beaker_grasp",
      "skill": "arm.move_linear",
      "version": "1.0.0",
      "arm": "right",
      "parameters": {
        "source_ref": "right.beaker.approach",
        "target_ref": "right.beaker.grasp",
        "grip_requirement": "open"
      },
      "depends_on": [
        "right_beaker_approach"
      ]
    },
    {
      "id": "right_beaker_close",
      "skill": "gripper.set_position",
      "version": "1.0.0",
      "arm": "right",
      "parameters": {
        "position": 0,
        "allow_release": false,
        "at_ref": "right.beaker.grasp"
      },
      "depends_on": [
        "right_beaker_grasp"
      ]
    },
    {
      "id": "right_beaker_work",
      "skill": "arm.move_joint",
      "version": "1.0.0",
      "arm": "right",
      "parameters": {
        "source_ref": "right.beaker.grasp",
        "target_ref": "right.beaker.work",
        "grip_requirement": "clamped"
      },
      "depends_on": [
        "right_beaker_close"
      ]
    }
  ]
}
