{
  "schema_version": "1.0.0",
  "name": "right_beaker_pour",
  "description": "Tip the right beaker about its estimated cup center; stream placement is uncalibrated. Assumes the beaker is already held at its work pose.",
  "nodes": [
    {
      "id": "right_beaker_pour",
      "skill": "arm.rotate_about_pivot",
      "version": "1.0.0",
      "arm": "right",
      "parameters": {
        "source_ref": "right.beaker.work"
      },
      "depends_on": []
    }
  ]
}
